{
  "$schema": "https://json-schema.org/draft/2020-12/schema",
  "$id": "urn:skaile:schema:datamodel-model",
  "title": "Data model — the stack-neutral semantic model",
  "description": "Generated by gen.ts from model.ts, the authored model, for every reader that wants data: the editor canvas, build-database, the tests. The required keys are those the host's DataModel shape (shared/schemas/datamodel.ts) requires, so a file valid here loads in the editor; the collection's own metadata hints (tree/10_blueprint/datamodel/model.md § Format, model metadata) are optional properties. Types are semantic, never SQL or Prisma types.",
  "x-artifact": "_concept/10_blueprint/datamodel/model.json",
  "type": "object",
  "required": ["version", "entities", "relationships"],
  "properties": {
    "version": { "const": "1.0" },
    "editor": {
      "type": "object",
      "description": "Canvas state; written by the editor, not by skills. gen.ts keeps it when it regenerates the file.",
      "required": ["viewport"],
      "properties": {
        "viewport": {
          "type": "object",
          "required": ["x", "y", "zoom"],
          "properties": {
            "x": { "type": "number" },
            "y": { "type": "number" },
            "zoom": { "type": "number" }
          }
        }
      }
    },
    "entities": {
      "type": "array",
      "items": { "$ref": "#/$defs/entity" }
    },
    "relationships": {
      "type": "array",
      "description": "Owning side only: o2m inverses are generated by the stack translator, and an m2m needs an explicit junction entity with an m2o to both sides.",
      "items": { "$ref": "#/$defs/relationship" }
    },
    "enums": {
      "type": "array",
      "description": "Shared enums, referenced by a field's enum_id.",
      "items": { "$ref": "#/$defs/enumDef" }
    }
  },
  "$defs": {
    "snakeName": {
      "type": "string",
      "pattern": "^[a-z][a-z0-9_]*$",
      "description": "lowercase snake_case, per tree/10_blueprint/datamodel/README.md § Naming."
    },
    "pascalValue": {
      "type": "string",
      "pattern": "^[A-Z][A-Za-z0-9]*$",
      "description": "PascalCase enum value; never SCREAMING_SNAKE or lowercase."
    },
    "modelName": {
      "type": "string",
      "pattern": "^[A-Z][A-Za-z0-9]*$",
      "description": "PascalCase singular model name, per tree/10_blueprint/datamodel/README.md § Naming."
    },
    "semanticType": {
      "enum": [
        "string", "text", "richtext", "integer", "float", "decimal", "boolean",
        "date", "datetime", "enum", "json", "image", "file", "uuid", "slug",
        "email", "url", "password", "relation"
      ],
      "description": "tree/10_blueprint/datamodel/model.md § Format, scalar types, plus enum and relation. decimal is in the collection's list but not yet in the host's; slug, email and url are the host's refinements of string."
    },
    "entity": {
      "type": "object",
      "required": ["id", "glossary_id", "display_name", "fields"],
      "properties": {
        "id": { "$ref": "#/$defs/modelName", "description": "The model name: PascalCase singular (Task, ProjectMember). A feature's data_entities[] entries, relationships' from/to and a field's relation_target all use it." },
        "glossary_id": {
          "type": "string",
          "pattern": "^[a-z0-9]+(-[a-z0-9]+)*$",
          "description": "Id of the glossary term this entity models: the kebab-case slug of the term (Order line → order-line). Must exist in _concept/glossary.md; the entity id is that term in PascalCase."
        },
        "status": { "const": "proposed", "description": "Present only on an entity a may_propose skill appended; the owner drops it on promotion (tree/README.md § Ownership)." },
        "proposed_by": { "type": "string", "description": "Skill that appended the proposed entity." },
        "proposed_on": { "type": "string", "description": "ISO date (YYYY-MM-DD) of the proposal." },
        "source": { "type": "string", "description": "Evidence reference or the user's words behind a proposed entity." },
        "display_name": { "type": "string" },
        "icon": { "type": "string", "description": "Iconify icon name." },
        "color": { "type": "string", "description": "Hex colour for canvas rendering." },
        "position": {
          "type": "object",
          "required": ["x", "y"],
          "properties": { "x": { "type": "number" }, "y": { "type": "number" } }
        },
        "from_features": {
          "type": "array",
          "items": { "type": "string" },
          "description": "Paths to feature files that require this entity."
        },
        "standard_fields": {
          "type": "array",
          "items": { "enum": ["id", "created_at", "updated_at"] },
          "description": "Fields the translator injects; they are not declared in fields. Defaults to all three."
        },
        "label_field": { "type": "string", "description": "Field used as display name in UI lists and dropdowns." },
        "key_field": { "type": "string", "description": "URL-friendly unique identifier field, when the entity has a readable slug." },
        "fields": {
          "type": "array",
          "items": { "$ref": "#/$defs/field" }
        }
      }
    },
    "field": {
      "type": "object",
      "required": ["id", "name", "type"],
      "properties": {
        "id": { "type": "string", "description": "Stable id for editor tracking (undo/redo, drag)." },
        "name": { "$ref": "#/$defs/snakeName" },
        "type": { "$ref": "#/$defs/semanticType" },
        "required": { "type": "boolean", "description": "Required unless set false; never a ? suffix." },
        "unique": { "type": "boolean" },
        "primary": { "type": "boolean" },
        "readonly": { "type": "boolean" },
        "indexed": { "type": "boolean" },
        "max_length": { "type": "integer", "minimum": 1 },
        "default": {},
        "placeholder": { "type": "string" },
        "faker": { "type": "string", "description": "Seed-generation hint, e.g. faker.internet.email." },
        "enum_id": { "type": "string", "description": "Reference to a shared enum definition." },
        "values": {
          "type": "object",
          "description": "Inline enum: PascalCase value to description.",
          "propertyNames": { "$ref": "#/$defs/pascalValue" },
          "additionalProperties": { "type": "string" }
        },
        "relation_target": { "$ref": "#/$defs/modelName", "description": "Target entity id (model name) for relation fields." },
        "description": { "type": "string" },
        "status": { "const": "proposed", "description": "Present only on a field a may_propose skill appended; the owner drops it on promotion (tree/README.md § Ownership)." },
        "proposed_by": { "type": "string", "description": "Skill that appended the proposed field." },
        "proposed_on": { "type": "string", "description": "ISO date (YYYY-MM-DD) of the proposal." },
        "source": { "type": "string", "description": "Evidence reference or the user's words behind a proposed field." }
      }
    },
    "relationship": {
      "type": "object",
      "required": ["id", "from", "from_field", "to", "type"],
      "properties": {
        "id": { "type": "string" },
        "from": { "$ref": "#/$defs/modelName", "description": "Source entity id (model name)." },
        "from_field": { "type": "string", "description": "Field name on the source entity; ends in _id for m2o." },
        "to": { "$ref": "#/$defs/modelName", "description": "Target entity id (model name)." },
        "type": { "enum": ["m2o", "o2m", "m2m"] },
        "label": { "type": "string" },
        "inverse_label": { "type": "string" },
        "required": { "type": "boolean" },
        "on_delete": { "enum": ["cascade", "set_null", "restrict"] }
      }
    },
    "enumDef": {
      "type": "object",
      "required": ["id", "values"],
      "properties": {
        "id": { "type": "string", "description": "Referenced by fields via enum_id." },
        "values": {
          "type": "array",
          "items": {
            "type": "object",
            "required": ["value", "label"],
            "properties": {
              "value": { "$ref": "#/$defs/pascalValue" },
              "label": { "type": "string" }
            }
          }
        }
      }
    }
  }
}
